[
  {
    "id": "eval-001",
    "question": "How many paid annual leave days do full-time employees receive at NovaTech Solutions?",
    "expected_answer_contains": [
      "30",
      "days"
    ],
    "source_doc_id": "novatech-solutions-leave-policy-2024",
    "source_section": "Annual Leave Entitlement",
    "company_id": "novatech-solutions",
    "difficulty": "easy",
    "answerable": true,
    "category": "factual",
    "policy_type": "leave_policy"
  },
  {
    "id": "eval-002",
    "question": "How many remote work days per week are allowed at NovaTech Solutions?",
    "expected_answer_contains": [
      "4"
    ],
    "source_doc_id": "novatech-solutions-remote-work-2024",
    "source_section": "Remote Schedule",
    "company_id": "novatech-solutions",
    "difficulty": "easy",
    "answerable": true,
    "category": "factual",
    "policy_type": "remote_work"
  },
  {
    "id": "eval-003",
    "question": "How often must employees complete code of conduct training at NovaTech Solutions?",
    "expected_answer_contains": [
      "14",
      "month"
    ],
    "source_doc_id": "novatech-solutions-code-of-conduct-2024",
    "source_section": "Training and Acknowledgment",
    "company_id": "novatech-solutions",
    "difficulty": "easy",
    "answerable": true,
    "category": "factual",
    "policy_type": "code_of_conduct"
  },
  {
    "id": "eval-004",
    "question": "What percentage of health insurance premiums does NovaTech Solutions cover for employees?",
    "expected_answer_contains": [
      "58",
      "%"
    ],
    "source_doc_id": "novatech-solutions-benefits-2024",
    "source_section": "Health and Dental Coverage",
    "company_id": "novatech-solutions",
    "difficulty": "easy",
    "answerable": true,
    "category": "factual",
    "policy_type": "benefits"
  },
  {
    "id": "eval-005",
    "question": "Within how many business days does NovaTech Solutions reimburse approved expenses?",
    "expected_answer_contains": [
      "45",
      "days"
    ],
    "source_doc_id": "novatech-solutions-expense-2024",
    "source_section": "Receipts and Submission",
    "company_id": "novatech-solutions",
    "difficulty": "easy",
    "answerable": true,
    "category": "factual",
    "policy_type": "expense"
  },
  {
    "id": "eval-006",
    "question": "How frequently are formal performance reviews conducted at NovaTech Solutions?",
    "expected_answer_contains": [
      "12",
      "month"
    ],
    "source_doc_id": "novatech-solutions-performance-2024",
    "source_section": "Review Cycle and Ratings",
    "company_id": "novatech-solutions",
    "difficulty": "easy",
    "answerable": true,
    "category": "factual",
    "policy_type": "performance"
  },
  {
    "id": "eval-007",
    "question": "How long is the structured onboarding program at NovaTech Solutions in business days?",
    "expected_answer_contains": [
      "11",
      "days"
    ],
    "source_doc_id": "novatech-solutions-onboarding-2024",
    "source_section": "Onboarding Program Timeline",
    "company_id": "novatech-solutions",
    "difficulty": "easy",
    "answerable": true,
    "category": "factual",
    "policy_type": "onboarding"
  },
  {
    "id": "eval-008",
    "question": "What is the required notice period for voluntary resignation at NovaTech Solutions?",
    "expected_answer_contains": [
      "90",
      "days"
    ],
    "source_doc_id": "novatech-solutions-termination-2024",
    "source_section": "Notice Period",
    "company_id": "novatech-solutions",
    "difficulty": "easy",
    "answerable": true,
    "category": "factual",
    "policy_type": "termination"
  },
  {
    "id": "eval-009",
    "question": "What is the minimum password length for corporate accounts at NovaTech Solutions?",
    "expected_answer_contains": [
      "14"
    ],
    "source_doc_id": "novatech-solutions-data-security-2024",
    "source_section": "Account and Password Standards",
    "company_id": "novatech-solutions",
    "difficulty": "easy",
    "answerable": true,
    "category": "factual",
    "policy_type": "data_security"
  },
  {
    "id": "eval-010",
    "question": "What is the domestic per diem allowance at NovaTech Solutions?",
    "expected_answer_contains": [
      "66",
      "$"
    ],
    "source_doc_id": "novatech-solutions-travel-2024",
    "source_section": "Per Diem and Lodging",
    "company_id": "novatech-solutions",
    "difficulty": "easy",
    "answerable": true,
    "category": "factual",
    "policy_type": "travel"
  },
  {
    "id": "eval-011",
    "question": "How many paid annual leave days do full-time employees receive at GreenLeaf Healthcare?",
    "expected_answer_contains": [
      "23",
      "days"
    ],
    "source_doc_id": "greenleaf-healthcare-leave-policy-2024",
    "source_section": "Annual Leave Entitlement",
    "company_id": "greenleaf-healthcare",
    "difficulty": "easy",
    "answerable": true,
    "category": "factual",
    "policy_type": "leave_policy"
  },
  {
    "id": "eval-012",
    "question": "How many remote work days per week are allowed at GreenLeaf Healthcare?",
    "expected_answer_contains": [
      "4"
    ],
    "source_doc_id": "greenleaf-healthcare-remote-work-2024",
    "source_section": "Remote Schedule",
    "company_id": "greenleaf-healthcare",
    "difficulty": "easy",
    "answerable": true,
    "category": "factual",
    "policy_type": "remote_work"
  },
  {
    "id": "eval-013",
    "question": "How often must employees complete code of conduct training at GreenLeaf Healthcare?",
    "expected_answer_contains": [
      "19",
      "month"
    ],
    "source_doc_id": "greenleaf-healthcare-code-of-conduct-2024",
    "source_section": "Training and Acknowledgment",
    "company_id": "greenleaf-healthcare",
    "difficulty": "easy",
    "answerable": true,
    "category": "factual",
    "policy_type": "code_of_conduct"
  },
  {
    "id": "eval-014",
    "question": "What percentage of health insurance premiums does GreenLeaf Healthcare cover for employees?",
    "expected_answer_contains": [
      "71",
      "%"
    ],
    "source_doc_id": "greenleaf-healthcare-benefits-2024",
    "source_section": "Health and Dental Coverage",
    "company_id": "greenleaf-healthcare",
    "difficulty": "easy",
    "answerable": true,
    "category": "factual",
    "policy_type": "benefits"
  },
  {
    "id": "eval-015",
    "question": "Within how many business days does GreenLeaf Healthcare reimburse approved expenses?",
    "expected_answer_contains": [
      "37",
      "days"
    ],
    "source_doc_id": "greenleaf-healthcare-expense-2024",
    "source_section": "Receipts and Submission",
    "company_id": "greenleaf-healthcare",
    "difficulty": "easy",
    "answerable": true,
    "category": "factual",
    "policy_type": "expense"
  },
  {
    "id": "eval-016",
    "question": "How frequently are formal performance reviews conducted at GreenLeaf Healthcare?",
    "expected_answer_contains": [
      "7",
      "month"
    ],
    "source_doc_id": "greenleaf-healthcare-performance-2024",
    "source_section": "Review Cycle and Ratings",
    "company_id": "greenleaf-healthcare",
    "difficulty": "easy",
    "answerable": true,
    "category": "factual",
    "policy_type": "performance"
  },
  {
    "id": "eval-017",
    "question": "How long is the structured onboarding program at GreenLeaf Healthcare in business days?",
    "expected_answer_contains": [
      "30",
      "days"
    ],
    "source_doc_id": "greenleaf-healthcare-onboarding-2024",
    "source_section": "Onboarding Program Timeline",
    "company_id": "greenleaf-healthcare",
    "difficulty": "easy",
    "answerable": true,
    "category": "factual",
    "policy_type": "onboarding"
  },
  {
    "id": "eval-018",
    "question": "What is the required notice period for voluntary resignation at GreenLeaf Healthcare?",
    "expected_answer_contains": [
      "65",
      "days"
    ],
    "source_doc_id": "greenleaf-healthcare-termination-2024",
    "source_section": "Notice Period",
    "company_id": "greenleaf-healthcare",
    "difficulty": "easy",
    "answerable": true,
    "category": "factual",
    "policy_type": "termination"
  },
  {
    "id": "eval-019",
    "question": "What is the minimum password length for corporate accounts at GreenLeaf Healthcare?",
    "expected_answer_contains": [
      "13"
    ],
    "source_doc_id": "greenleaf-healthcare-data-security-2024",
    "source_section": "Account and Password Standards",
    "company_id": "greenleaf-healthcare",
    "difficulty": "easy",
    "answerable": true,
    "category": "factual",
    "policy_type": "data_security"
  },
  {
    "id": "eval-020",
    "question": "What is the domestic per diem allowance at GreenLeaf Healthcare?",
    "expected_answer_contains": [
      "54",
      "$"
    ],
    "source_doc_id": "greenleaf-healthcare-travel-2024",
    "source_section": "Per Diem and Lodging",
    "company_id": "greenleaf-healthcare",
    "difficulty": "easy",
    "answerable": true,
    "category": "factual",
    "policy_type": "travel"
  },
  {
    "id": "eval-021",
    "question": "How many paid annual leave days do full-time employees receive at Urban Retail Group?",
    "expected_answer_contains": [
      "27",
      "days"
    ],
    "source_doc_id": "urban-retail-group-leave-policy-2024",
    "source_section": "Annual Leave Entitlement",
    "company_id": "urban-retail-group",
    "difficulty": "easy",
    "answerable": true,
    "category": "factual",
    "policy_type": "leave_policy"
  },
  {
    "id": "eval-022",
    "question": "How many remote work days per week are allowed at Urban Retail Group?",
    "expected_answer_contains": [
      "0"
    ],
    "source_doc_id": "urban-retail-group-remote-work-2024",
    "source_section": "Remote Schedule",
    "company_id": "urban-retail-group",
    "difficulty": "easy",
    "answerable": true,
    "category": "factual",
    "policy_type": "remote_work"
  },
  {
    "id": "eval-023",